content,likes,comments,shares,Engagement_Score,timestamp,Platform,author,post_id,platform,Quotes,engagement_score
DevSecOps Course for Beginners  API Security,1232,23,0,1255.0,2025-08-12 13:48:57,YouTube,UC8butISFwT-Wl7EV0hUK0BQ,JfiWi8RjN-8,YouTube,,1255
Abandoning med school to become a software engineer with Edidiong Asikpo [Podcast #182],442,45,0,487.0,2025-08-08 13:00:45,YouTube,UC8butISFwT-Wl7EV0hUK0BQ,N0K0m7dZBJI,YouTube,,487
Time Series Forecasting in Python  Tutorial for Beginners,1183,31,0,1214.0,2025-08-07 14:14:44,YouTube,UC8butISFwT-Wl7EV0hUK0BQ,fxx_E0ojKrc,YouTube,,1214
Google Cloud Associate Cloud Engineer Course [2025] - Pass the Exam!,1079,63,0,1142.0,2025-08-05 14:16:26,YouTube,UC8butISFwT-Wl7EV0hUK0BQ,OlAmyf8_4O4,YouTube,,1142
React Course for Beginners w/ Tailwind CSS [2025],1889,81,0,1970.0,2025-08-04 13:56:59,YouTube,UC8butISFwT-Wl7EV0hUK0BQ,IJ85kCdqWao,YouTube,,1970
Senior Playstation Engineer's tips for learning new tools and getting things done [Podcast #184],519,32,0,551.0,2025-08-01 13:30:09,YouTube,UC8butISFwT-Wl7EV0hUK0BQ,C7UI_4jIGSQ,YouTube,,551
Why Algorithms Work  Algorithm Analysis Deep Dive Course,1902,51,0,1953.0,2025-07-30 14:33:21,YouTube,UC8butISFwT-Wl7EV0hUK0BQ,ku6HZ_k9qgY,YouTube,,1953
Technical Writing Course for Beginners,1964,47,0,2011.0,2025-07-29 14:49:00,YouTube,UC8butISFwT-Wl7EV0hUK0BQ,vT5pcc30Ffw,YouTube,,2011
How to turn Open Source into a Job with Nick Taylor [Podcast #181],452,17,0,469.0,2025-07-25 13:01:36,YouTube,UC8butISFwT-Wl7EV0hUK0BQ,m7nkioXNiik,YouTube,,469
"Enterprise AI Tutorial  Embeddings, RAG, and Multimodal Agents Using Amazon Nova and Bedrock",963,37,0,1000.0,2025-07-24 13:33:08,YouTube,UC8butISFwT-Wl7EV0hUK0BQ,HaUe2AN210g,YouTube,,1000
Learn TypeScript  Crash Course for Beginners,1206,70,0,1276.0,2025-07-23 12:34:25,YouTube,UC8butISFwT-Wl7EV0hUK0BQ,ZvZ7gvcmPmI,YouTube,,1276
Data Structure and Algorithm Patterns for LeetCode Interviews  Tutorial,5276,102,0,5378.0,2025-07-22 14:32:52,YouTube,UC8butISFwT-Wl7EV0hUK0BQ,Z_c4byLrNBU,YouTube,,5378
We are truly in the Hackathon Era  Namanh Kapur interview [Podcast #180],537,41,0,578.0,2025-07-18 13:01:14,YouTube,UC8butISFwT-Wl7EV0hUK0BQ,clTpnp0TlYg,YouTube,,578
Data Viz w/ Svelte and D3 Tutorial  Custom and Interactive Data Visualization,340,10,0,350.0,2025-07-16 14:06:03,YouTube,UC8butISFwT-Wl7EV0hUK0BQ,XSJD5ay1D_8,YouTube,,350
Building Security into AI  Tutorial,887,26,0,913.0,2025-07-15 13:35:29,YouTube,UC8butISFwT-Wl7EV0hUK0BQ,0xah5jMflcI,YouTube,,913
799 rejections... but he got the job! Braydon Coyer developer interview [Podcast #179],357,39,0,396.0,2025-07-11 13:01:26,YouTube,UC8butISFwT-Wl7EV0hUK0BQ,ilotANpzN7I,YouTube,,396
Build and Deploy a Polished AI Project and Get Sales,2337,94,0,2431.0,2025-07-10 13:00:56,YouTube,UC8butISFwT-Wl7EV0hUK0BQ,ObiAWFqgpMg,YouTube,,2431
VGG From Scratch  Deep Learning Theory & PyTorch Implementation (Full Course),994,24,0,1018.0,2025-07-09 13:53:06,YouTube,UC8butISFwT-Wl7EV0hUK0BQ,rhCiuu4AW_w,YouTube,,1018
Combine Vibe Coding & n8n to Build Real AI Apps,1713,117,0,1830.0,2025-07-08 14:04:11,YouTube,UC8butISFwT-Wl7EV0hUK0BQ,qDtVzumlb8M,YouTube,,1830
From freeCodeCamp to NASA with Data Engineer Joe Hill [Podcast #178],551,35,0,586.0,2025-07-04 12:01:15,YouTube,UC8butISFwT-Wl7EV0hUK0BQ,cMOz7Tyq7aE,YouTube,,586
"Google Calendar Clone Tutorial  PHP, MySQL, JavaScript, HTML, and CSS",1310,54,0,1364.0,2025-07-03 12:45:09,YouTube,UC8butISFwT-Wl7EV0hUK0BQ,pHMtbdGoP_g,YouTube,,1364
Google Cloud Cybersecurity Certificate Course,2021,67,0,2088.0,2025-07-01 15:14:53,YouTube,UC8butISFwT-Wl7EV0hUK0BQ,DrAZf4ZHqaM,YouTube,,2088
Rust VS Go VS TypeScript which back end language is for you with Tai Groot [Podcast #176],508,82,0,590.0,2025-06-27 12:01:56,YouTube,UC8butISFwT-Wl7EV0hUK0BQ,yDhCweudqyY,YouTube,,590
Evolution of the Transformer Architecture Used in LLMs (20172025)  Full Course,1263,47,0,1310.0,2025-06-26 12:58:58,YouTube,UC8butISFwT-Wl7EV0hUK0BQ,8WBS0dT0h2I,YouTube,,1310
"Build a Calendly Clone  Full Stack Next.js, Typescript, React, Tailwind",1300,56,0,1356.0,2025-06-24 13:12:29,YouTube,UC8butISFwT-Wl7EV0hUK0BQ,cCuvlQvU1eg,YouTube,,1356
Complete German Language Beginners Course  Learn A1 Level German,6026,424,0,6450.0,2025-06-19 12:56:01,YouTube,UC8butISFwT-Wl7EV0hUK0BQ,0p4RCJ8P5ko,YouTube,,6450
Google Cloud Data Analytics Certificate Course,1549,39,0,1588.0,2025-06-17 12:41:28,YouTube,UC8butISFwT-Wl7EV0hUK0BQ,GAdgTK2Esn4,YouTube,,1588
"MLOps Pipeline with Python, AWS, Docker  YouTube Viewer Sentiment",1571,58,0,1629.0,2025-06-13 13:01:15,YouTube,UC8butISFwT-Wl7EV0hUK0BQ,gwNPV882tkc,YouTube,,1629
From Therapist to six figure freelance dev [Podcast #176],444,29,0,473.0,2025-06-13 12:30:19,YouTube,UC8butISFwT-Wl7EV0hUK0BQ,NCvKYoTeJR0,YouTube,,473
MERN Stack Tutorial for Beginners with Deployment  2025,4729,207,0,4936.0,2025-06-10 13:30:18,YouTube,UC8butISFwT-Wl7EV0hUK0BQ,F9gB5b4jgOI,YouTube,,4936
From electrical engineering student to CTO with Hitesh Choudhary [Podcast #175],1486,112,0,1598.0,2025-06-06 12:00:13,YouTube,UC8butISFwT-Wl7EV0hUK0BQ,7bS52JVHEk0,YouTube,,1598
C Programming with Raylib  Match3 Game Tutorial,1134,58,0,1192.0,2025-06-04 13:09:35,YouTube,UC8butISFwT-Wl7EV0hUK0BQ,P7PMA3X1tf8,YouTube,,1192
General Chemistry  Full University Course,3206,254,0,3460.0,2025-06-03 13:39:40,YouTube,UC8butISFwT-Wl7EV0hUK0BQ,6OV3tmt9uhs,YouTube,,3460
How to Survive in Tech When Everything's Changing w/ 21-year Veteran Dev Joe Attardi [Podcast #174],1307,98,0,1405.0,2025-05-30 12:00:01,YouTube,UC8butISFwT-Wl7EV0hUK0BQ,07NdHM6pE6M,YouTube,,1405
Learn Python for Data Science  Full Course for Beginners,8200,286,0,8486.0,2025-05-29 13:44:02,YouTube,UC8butISFwT-Wl7EV0hUK0BQ,CMEWVn1uZpQ,YouTube,,8486
Build REST APIs in .NET 9  Full Course for Beginners,1184,46,0,1230.0,2025-05-28 13:00:05,YouTube,UC8butISFwT-Wl7EV0hUK0BQ,38GNKtclDdE,YouTube,,1230
Building a Vision Transformer Model from Scratch with PyTorch,1164,57,0,1221.0,2025-05-27 13:39:47,YouTube,UC8butISFwT-Wl7EV0hUK0BQ,7o1jpvapaT0,YouTube,,1221
Laid off but not afraid with X-senior Microsoft Dev MacKevin Fey [Podcast #173],451,50,0,501.0,2025-05-23 17:17:27,YouTube,UC8butISFwT-Wl7EV0hUK0BQ,MHrbAlLpIWs,YouTube,,501
Vue.js Course for Beginners,1207,44,0,1251.0,2025-05-22 14:03:44,YouTube,UC8butISFwT-Wl7EV0hUK0BQ,8pn9KEuXG28,YouTube,,1251
"Relational DBMS Course  Database Concepts, Design & Querying Tutorial",2239,99,0,2338.0,2025-05-21 13:03:10,YouTube,UC8butISFwT-Wl7EV0hUK0BQ,NdeeSEknp58,YouTube,,2338
LangGraph Complete Course for Beginners  Complex AI Agents with Python,5795,201,0,5996.0,2025-05-20 13:56:22,YouTube,UC8butISFwT-Wl7EV0hUK0BQ,jGg_1h0qzaM,YouTube,,5996
"Making Developer Friends Anywhere, with Iraqi Engineer Code;Life [Podcast #172]",606,151,0,757.0,2025-05-16 11:01:50,YouTube,UC8butISFwT-Wl7EV0hUK0BQ,yx1ri8X37S4,YouTube,,757
Complete Spanish Language Beginners Course  Learn A1 Level Spanish,4003,559,0,4562.0,2025-05-15 13:37:04,YouTube,UC8butISFwT-Wl7EV0hUK0BQ,bp9OZoQu3A0,YouTube,,4562
Vite Crash Course  Frontend Build Tool,1185,43,0,1228.0,2025-05-14 13:01:22,YouTube,UC8butISFwT-Wl7EV0hUK0BQ,do62-z3z6FM,YouTube,,1228
Android & Kotlin Development Masterclass  Full Course,7062,586,0,7648.0,2025-05-12 13:22:06,YouTube,UC8butISFwT-Wl7EV0hUK0BQ,blKkRoZPxLc,YouTube,,7648
Ditching My Microsoft Job for Startup Purgatory with Sam Crombie [Podcast #171],244,12,0,256.0,2025-05-09 09:00:32,YouTube,UC8butISFwT-Wl7EV0hUK0BQ,FHLmuNj20bA,YouTube,,256
Generative AI Bootcamp  Complete 65-Hour Course,9364,625,0,9989.0,2025-05-08 14:52:44,YouTube,UC8butISFwT-Wl7EV0hUK0BQ,DOXJ7s1D6iE,YouTube,,9989
India  Quantum Secret Mission  | #shots #ytshorts #facts,0,2,0,2.0,2025-08-20 11:32:46,YouTube,,FouxdLd99LY,YouTube,,2
How Quantum Computing Could Make AI More Affordable and Powerful | Sygaldry Startup Insight,0,0,0,0.0,2025-08-20 11:03:54,YouTube,,aC9HQp7ZvzI,YouTube,,0
XRP $5M: QUANTUM COMPUTING LOCK BROKEN (XRPL UNLOCKS 1000X SPEED),8,28,0,36.0,2025-08-20 11:00:51,YouTube,,UHb8XgWa4fA,YouTube,,36
Revolutionizing Quantum Computing: Storing Quantum Data with Sound,0,0,0,0.0,2025-08-20 10:52:35,YouTube,,AwvYZYxNdS4,YouTube,,0
Unlocking Universal Quantum Computing with Neglected Anyons,0,0,0,0.0,2025-08-20 10:49:21,YouTube,,XDypTXvuNnY,YouTube,,0
Unlocking Quantum Computing: The Hidden Power of Neglected Particles,0,0,0,0.0,2025-08-20 10:47:43,YouTube,,2Yj4gnpSDN4,YouTube,,0
Yah bilkul sahi hai AI robotics Quantum computing yah sab jab Apne acchi sthiti mein pahuncjaen #ai,0,0,0,0.0,2025-08-20 10:32:55,YouTube,,Xl3vED_nfO4,YouTube,,0
TCS Cyber Quantum Computing,6,0,0,6.0,2025-08-20 10:29:32,YouTube,,uhUiX_sbHoU,YouTube,,6
The Next Leap or Ethical Minefield?(Quantum Computing),0,0,0,0.0,2025-08-20 10:26:49,YouTube,,phxxERlPmZg,YouTube,,0
QUBT Stock (Quantum Computing stock) QUBT STOCK PREDICTION QUBT STOCK analysis QUBT stock news,0,0,0,0.0,2025-08-20 10:15:34,YouTube,,Awu2reRwIqo,YouTube,,0
Neglectons: The Overlooked Particles That Could Unlock Universal Quantum Computing,0,0,0,0.0,2025-08-20 10:01:07,YouTube,,IjpLe0-nvOQ,YouTube,,0
Quantum Superposition Explained in 1 Minute | Schrdingers Cat &amp; Quantum Computers,1,0,0,1.0,2025-08-20 10:00:48,YouTube,,TuP8d2alMjc,YouTube,,1
Neglectons: The Game-Changing Quasiparticles for Quantum Computing,0,0,0,0.0,2025-08-20 09:59:59,YouTube,,AYIHnBW4ARY,YouTube,,0
Breakthrough in Quantum Computing: Achieving Fast &amp; Coherent Qubits,0,0,0,0.0,2025-08-20 09:27:08,YouTube,,4g80Sq82NFE,YouTube,,0
Quantum Shock: Amazons Chip Predicts Earth&#39;s End Date and Shuts Down!,0,0,0,0.0,2025-08-20 09:13:26,YouTube,,ijjYx5AvHDE,YouTube,,0
Super Hero Tung #tungtungtungsahur #ai #shorts #animation #story #hero #fyp #anomali #youtubeshorts,6,0,0,6.0,2025-08-20 11:21:14,YouTube,,7xS1PShzvMs,YouTube,,6
#mewmew #cutebaby #cat #cats #catvideos #mew #ai #love #music,14,0,0,14.0,2025-08-20 10:30:35,YouTube,,HYzAboTV7_0,YouTube,,14
"CHUNG KT I CHIN NH SNG TO - MA 6: AIMFOV, INFINITY, CU L TEAM, MC LP TEAM - AI L NH VUA",5732,0,0,5732.0,2025-08-20 08:45:53,YouTube,,K0lGDSNsSMM,YouTube,,5732
poor baby Rio emotional   Fish story #shoerts #baby #emotional #ai,18,0,0,18.0,2025-08-20 08:43:34,YouTube,,2jtkqZsGclU,YouTube,,18
[ ] ! AI           -  /  / MBN,31,0,0,31.0,2025-08-20 07:12:29,YouTube,,0cLH-r0m4ls,YouTube,,31
emotional money kahani #cartoon #ai #trending #viral #bandar #fannyvideo,27,0,0,27.0,2025-08-20 01:36:16,YouTube,,oOxwphERFxg,YouTube,,27
The Thirsty Farmer &amp; The Pigeon | Heart-Touching Moral Story || #ai #viral,16,0,0,16.0,2025-08-20 01:34:47,YouTube,,LLsfWApUfvA,YouTube,,16
Dolphin Invite Monkey For Lunch #ai  #mokey #styamrox #wgitachi #vikramsarkar,66,0,0,66.0,2025-08-20 00:39:20,YouTube,,Qqp8-sETAkk,YouTube,,66
Ai shorts Cute Baby Dance #babyshorts #baby #ai #techartgenius #viralvideos #aishorts,139,0,0,139.0,2025-08-20 00:03:27,YouTube,,aV_vGqgJXVI,YouTube,,139
Jessica&#39;s Journey! From joy to Grief! #orca #orcashow #jessica #killerwhales #ai #shortsviral,31,0,0,31.0,2025-08-19 19:10:50,YouTube,,8ACsD7aVjik,YouTube,,31
The AI Bubble: Why 95% of GenAI Projects Are Failing | Vantage with Palki Sharma | N18G,7417,903,0,8320.0,2025-08-19 18:10:00,YouTube,,Zsh6VgcYCdI,YouTube,,8320
AI MOVIE OF ISLAMIC HELL: Jahannam in the Quran,1640,171,0,1811.0,2025-08-19 17:47:00,YouTube,,QURgzUvOSX0,YouTube,,1811
AI Village is getting scary,1673,219,0,1892.0,2025-08-19 17:47:24,YouTube,,eTgYehlVEBo,YouTube,,1892
RANU BOMBAI KI RANU#FolkSong#Ai#Trending#Ytshorts #top #1million#views#ytshorts #folkmusic,0,0,0,0.0,2025-08-19 16:54:40,YouTube,,2Jykw1kj3o0,YouTube,,0
"Learn Coding Without Laptop | Free Coding Channels 2025 | SQL, Python, AI, Data Science",1670,2,0,1672.0,2025-08-19 16:52:39,YouTube,,p4liieZRABU,YouTube,,1672
Jurassic world Evolution 2 Chaos theory 2,0,0,0,0.0,2025-08-20 10:53:58,YouTube,,AoF_GXbNngU,YouTube,,0
Miras Evolution &amp; The Lore Fan Theories Exploded K Pop Demon Hunters,0,0,0,0.0,2025-08-20 10:15:10,YouTube,,vOKN4k6Okj4,YouTube,,0
evolution of spiderman #spiderman #sirenheadhulk #avengersforever #shorts,5,0,0,5.0,2025-08-20 10:01:09,YouTube,,fybyyErfZEQ,YouTube,,5
Evolution | Darwin theory Natural selection | Class 12 #biologywithaman #cbse12thbiology #biology,2,0,0,2.0,2025-08-20 09:30:17,YouTube,,BT3u4l2o7nQ,YouTube,,2
Christian professor destroys the theory of evolution #christianshorts,0,0,0,0.0,2025-08-20 06:28:08,YouTube,,23WbUqU_RhA,YouTube,,0
My Theory on Creation #comedy #standupcomedy # #funny #humor #evolution #creation #comedian,1,0,0,1.0,2025-08-20 06:24:02,YouTube,,Chd-3V8vU-w,YouTube,,1
evolution theory,0,0,0,0.0,2025-08-20 05:50:06,YouTube,,WYjf93SnTqc,YouTube,,0
BREAKTHROUGH: New Human Ancestor Discovery Proves Evolution Isn&#39;t Linear | Ethiopia Fossils,0,0,0,0.0,2025-08-20 05:17:24,YouTube,,5nkt5gTrsQY,YouTube,,0
The Day Science Challenged Belief | Darwins Theory First Published  #BigBangBogan #,870,18,0,888.0,2025-08-20 03:30:42,YouTube,,pu3zozrOYnk,YouTube,,888
&quot;Theory of Evolution          | Audiobook Summary in Hindi&quot;,3,0,0,3.0,2025-08-20 02:30:08,YouTube,,6ex_SILozsY,YouTube,,3
Brian Cox Explica el Big Bang y la Evolucin del Universo Complejo,253,4,0,257.0,2025-08-19 21:00:54,YouTube,,u8V4Ctz8__U,YouTube,,257
TEORIA DA Evoluo Darwin,0,0,0,0.0,2025-08-19 19:37:21,YouTube,,GiwhJhHLYHg,YouTube,,0
Can Evolutionary Theory Explain Anxiety In Eating Disorders? | Eating Disorder Support Hub,0,0,0,0.0,2025-08-19 19:22:53,YouTube,,aKIjosrcvzM,YouTube,,0
SHIN GODZILLA 2 | Godzilla&#39;s TERRIFYING Next Evolution?! (Atomic Theory),1822,150,0,1972.0,2025-08-19 16:30:03,YouTube,,php8Vv2buzo,YouTube,,1972
New Early Homo Species Discovered that Challenges &#39;Ape-to-Human&#39; Evolution Theory,1,0,0,1.0,2025-08-19 16:30:31,YouTube,,xiBTrTk7D4Q,YouTube,,1
Databricks CEO on AI: VCs are wondering if agentic AI will actually automate work,182,46,0,228.0,2025-08-19 18:49:34,YouTube,,ofXC5fcdmaQ,YouTube,,228
Zero To Your First AI Agent In 26 Minutes (no code),1374,118,0,1492.0,2025-08-19 15:45:00,YouTube,,DV0Ln7HRyJQ,YouTube,,1492
Poor Cat Never Gave Up  from Courage  #ai #aiart #veo3 #meow #cartoon #cats,195,1,0,196.0,2025-08-20 05:02:45,YouTube,,Mz8XPihP0WQ,YouTube,,196
New FREE Chinese Computer Use AI Agent is INSANE!,216,19,0,235.0,2025-08-19 16:45:08,YouTube,,sCTPIuktCok,YouTube,,235
Book Summary in Hindi | The Theory of Evolution | John Maynard Smith Books | Audiobook | BOOKSETS,1,0,0,1.0,2025-08-19 15:00:06,YouTube,,DkJUr8_5Eiw,YouTube,,1
Macroevolution is False  | Correction Theory vs Darwinism | Super Intelligent Creator?,2,0,0,2.0,2025-08-19 10:28:43,YouTube,,y25A8Du_F9o,YouTube,,2
#funny #automobile #memes #duet #trending #ai #lifeisbutadream #aivideo #comedy #aishorts #shorts,8,0,0,8.0,2025-08-20 11:30:06,YouTube,,3uLAk_y4COs,YouTube,,8
hungry farmer eat a many lot of eggs#kidsstory#ai#aistory,0,0,0,0.0,2025-08-20 09:43:57,YouTube,,Zt1TKVDJY-Q,YouTube,,0
"@madmikevidal54 @XFrance @X @elonmusk @grok J'tais fatigue de tt essayer/chercher la cause, hier je suis alle voir en boutique mon vendeur de smartphone. Lui en + est s/X, a essay plein de choses et mises  jour, a fini par me dire que c'est peut-tre que j'ai dpass les 6000 abos et trop, la page ne peut charger",0,0,0,,,X,1387507067913658371,1957938131635683499,X,0.0,0
"Passou no suvaco sujo entao ne, ai contaminou a pedra com as bacterias que produzem o cc https://t.co/wYuCbiUFIC",0,0,0,,,X,1641861439,1957938131166195943,X,0.0,0
RT @mc_yelllow: Aprs 6 ans d'Internat j'ai enfin mon diplme d'tudes spcialises de neurochirurgie EN MME TEMPS que ma thse de mdecin,0,0,1452,,,X,2183430129,1957938131149168997,X,0.0,1452
"a minha me acabou de dar um berro aqui falando ''GANHEEEI'' ai eu perguntei o que, e ela disse ''o tupperware  da rifa'' KKKKKK",0,0,0,,,X,2962450743,1957938131048542354,X,0.0,0
GP-molformer11SMILES(100)(Pair-tuning)Linear Attention(AI)100https://t.co/GzojWZa77D,0,0,0,,,X,1132624565664768001,1957938129974735017,X,0.0,0
"@carvalhobibiii ai, eu fico me mordendo de dio, mas t cansada de sempre tocar na mesma tecla",0,0,0,,,X,1646916465973420037,1957938129920229722,X,0.0,0
"RT @JulianGoldieSEO:  NEW: Free AI agent that controls your computer is INSANE Made by ByteDance (yes, TikTok company)  It literally cl",0,0,6,,,X,1462553642,1957938129790456221,X,0.0,6
@grok @SecScottBessent How? When automation and AI will replace human jobs to an extent?,0,0,0,,,X,58196438,1957938129438208493,X,0.0,0
"RT @unusual_whales: CEOs are warning entry-level jobs are on the brink of extinction thanks to AI, per FORTUNE",0,0,1151,,,X,902504592,1957938128599282172,X,0.0,1151
Je l'ai djas dit je dteste ce monde,0,0,0,,,X,1591534815450480640,1957938128322457716,X,0.0,0
integration of AI with Quantum computing and effect on this world,1,0,0,1.0,2025-08-20 12:24:35,YouTube,,kKrw0Wc5u7k,YouTube,,1
The kitten couldnt do anything#ai #catvideos #story #shorts,0,0,0,0.0,2025-08-20 10:06:36,YouTube,,XgncK5CNAyQ,YouTube,,0
"Doru Bucu - Nicuor Dan, un Klaus Iohannis low cost? | Ai aflat! Cu Ionu Cristache",215,0,0,215.0,2025-08-20 09:11:47,YouTube,,bTFH-zN7bZI,YouTube,,215
coming soon status video #ganeshchaturthi #ai #viralshorts #1million,0,0,0,0.0,2025-08-20 07:49:01,YouTube,,XUkh00T8f_Y,YouTube,,0
OpenAIs Future of AI &amp; Crypto | Taylor Swifts Bold Move to Reclaim Music &amp; End Eras Tour,1687,0,0,1687.0,2025-08-20 06:00:29,YouTube,,Vw0LNtpWNbQ,YouTube,,1687
bechara monkey #amazing #ai #viralshort #cartoon #video,7,0,0,7.0,2025-08-20 01:44:24,YouTube,,JIKkWvViv50,YouTube,,7
Evolution | Darwin theory Natural selection | Class 12 #biologywithaman #cbse12thbiology #biology,0,0,0,0.0,2025-08-20 12:35:20,YouTube,,56CNMORRMrE,YouTube,,0
Charles Darvin Evolution Theory | Atom,0,0,0,0.0,2025-08-20 12:30:16,YouTube,,GS9dZ3pe92s,YouTube,,0
"#Spotify premium free you from your pic of the theory of evolution $1,000000",0,0,0,0.0,2025-08-20 12:15:25,YouTube,,nn6KLum0ShE,YouTube,,0
Chaos Theory &amp; The Evolution of Mind,0,0,0,0.0,2025-08-20 12:04:03,YouTube,,H2MkfxgvJSA,YouTube,,0
A farmer has a hen that lays golden eggs#ai#shorts,2,0,0,2.0,2025-08-20 12:05:29,YouTube,,znkUhkyzbuA,YouTube,,2
Quantum Computing Revolution: Rigetti and MSU&#39;s Cutting-Edge Research,0,0,0,0.0,2025-08-20 19:27:24,YouTube,,3758smfcirI,YouTube,,0
Orca Computing deploys two photonic quantum computers at Montana State University,0,0,0,0.0,2025-08-20 19:18:48,YouTube,,Zbq7pxE2On0,YouTube,,0
Quantum Computing Stocks: The Race for Patent Dominance,0,0,0,0.0,2025-08-20 19:10:41,YouTube,,I8_tvhawYWM,YouTube,,0
Quantum computing will destroy the blockchain,0,0,0,0.0,2025-08-20 19:00:10,YouTube,,5KPuR11xxTs,YouTube,,0
Quantum Computing Revolution Explained,0,0,0,0.0,2025-08-20 18:48:46,YouTube,,1-2BuUq3znc,YouTube,,0
New Technology Trends for 2025 AI Quantum Computing ...,0,1,0,1.0,2025-08-20 18:05:37,YouTube,,iIMUZWBaBqI,YouTube,,1
Power of Quantum Computing - Promo,1,0,0,1.0,2025-08-20 18:03:10,YouTube,,Uo8ZIqBturE,YouTube,,1
New Future Tech 2026 Quantum Computers Will Replace Supercomputer #2026 #ai #yt #shorts #new #viral,0,0,0,0.0,2025-08-20 17:53:47,YouTube,,t60iL4rScc8,YouTube,,0
Physical Review Journal Club: Superconducting Quantum Computing Beyond 100 Qubits,1,0,0,1.0,2025-08-20 17:24:59,YouTube,,4KnXPPulacQ,YouTube,,1
Scientists just solved quantum computings biggest problem #technews #ainews #coding #python #html,9,0,0,9.0,2025-08-20 17:17:49,YouTube,,Owah83Rstm8,YouTube,,9
Quantum Computers: The Terrifying Truth About Our Future #shorts,0,0,0,0.0,2025-08-20 17:16:47,YouTube,,gAjTma7cBiw,YouTube,,0
Hackers Used Flashlight to Exploit Quantum Computer! #shorts,0,0,0,0.0,2025-08-20 17:16:36,YouTube,,2kCyfPGQoCk,YouTube,,0
How 2026 ? Quantum Computing The Tech That Will Change EVERYTHING #ai #new #india @YouTube #1m,2,0,0,2.0,2025-08-20 17:04:07,YouTube,,x2hfhvjHPs8,YouTube,,2
QuEra &amp; Deloitte Alliance: Enterprise Quantum Computing Revolution Begins,0,0,0,0.0,2025-08-20 16:51:34,YouTube,,-20sfLUd6SU,YouTube,,0
"Tensor Networks in Quantum Computing: Applications, Challenges, and Future Opportunities",0,0,0,0.0,2025-08-20 16:48:16,YouTube,,aXw7vTlF24M,YouTube,,0
Augusztus 20-ai tzijtk szent Istvn napja,241,0,0,241.0,2025-08-20 17:59:37,YouTube,,vEwALYgnmr0,YouTube,,241
AI-Addicted Friend,67,1,0,68.0,2025-08-20 15:01:43,YouTube,,fzzclfuKsfg,YouTube,,68
AI REVEALS EXACT IBPS Interface &amp; Pattern  IBPS PO 2025 Quant Paper || Harshal Sir,527,0,0,527.0,2025-08-20 14:42:22,YouTube,,QCorgq59K8I,YouTube,,527
#veo3 #ai #stalker # # #venom #film #marvel #mcu,15,0,0,15.0,2025-08-20 14:12:58,YouTube,,7eC3_pkshgI,YouTube,,15
#veo3 #ai #stalker # # # # #kino #,10,0,0,10.0,2025-08-20 14:08:19,YouTube,,uIfxllqXLrA,YouTube,,10
TRANSFORMASI SELEKEH TERBURUK AI TEAM 2025 !!!,27395,2083,0,29478.0,2025-08-20 12:05:48,YouTube,,YzJgjdBoIW8,YouTube,,29478
AIYouTuber,79,8,0,87.0,2025-08-20 10:05:40,YouTube,,68ltOc4tGws,YouTube,,87
Ai shorts Cute Baby Dance #babyshorts #baby #ai #techartgenius #viralvideos #aishorts,50,0,0,50.0,2025-08-20 09:49:49,YouTube,,VVjUVNlhTdc,YouTube,,50
tag your love #music#love#song#yoursong #viral ##trending#ai #handmade#ring#art#couple,775,0,0,775.0,2025-08-20 08:43:54,YouTube,,QXW-DNOzqgg,YouTube,,775
Tallest Swimmer vs Reporter  Unbelievable Height Difference!#shorts #swimmer #volleyball #ai,120,0,0,120.0,2025-08-20 07:36:15,YouTube,,paZrgZNdoSs,YouTube,,120
Cline Dion -I&#39;m Alive. When I Need You Lyrics#lyricsvideo#ai#lyricsvideo,170,8,0,178.0,2025-08-20 06:00:35,YouTube,,cvnNLwCrrGk,YouTube,,178
[PART 2] C.ai bot/characters react to Criminal M!YN as...//No speed 2x// READ PINNED COMMENT.,2375,120,0,2495.0,2025-08-20 06:00:06,YouTube,,gRi7MxYRKqo,YouTube,,2495
L&#39;IA fait maintenant l&#39;IMPOSSIBLE (5 preuves cette semaine)  et c&#39;est Gratuit !,821,55,0,876.0,2025-08-20 06:01:16,YouTube,,GMkZdreSDMI,YouTube,,876
#ai lip sync song|ai animated video |#youtube shorts |#shorts feed| @nathans2010,21,0,0,21.0,2025-08-20 05:37:23,YouTube,,2_Oguk2dTLg,YouTube,,21
The Big Bang Theory _ 2007 Cast Evolution 2025 #movie,0,0,0,0.0,2025-08-20 18:12:24,YouTube,,X2XAJTiFE28,YouTube,,0
Jurassic World Evolution: Chaos Theory - Part 14 - Jurassic world completed it mate,1,0,0,1.0,2025-08-20 17:31:15,YouTube,,T65NPfz_O6g,YouTube,,1
Darwin&#39;s Theory of evolution  vs &#39;Dashavtaras&#39; of Vishnu | Narsimha sketch |,7,1,0,8.0,2025-08-20 17:24:30,YouTube,,jpfvP0QgjDc,YouTube,,8
Science  Sanatan    || Evolution vs Dashavatara || #shorts,5,0,0,5.0,2025-08-20 14:38:00,YouTube,,6iCV76FXIho,YouTube,,5
Theory of Evolution,0,0,0,0.0,2025-08-20 14:16:53,YouTube,,ZxKabydacHo,YouTube,,0
"Theory Of Evolution - Mama I&#39;m Coming Home @ Oliver&#39;s Beer Garden Erie, PA 8-8-25",0,3,0,3.0,2025-08-20 13:50:26,YouTube,,TphfoF4kZCA,YouTube,,3
Evolution 01Origin of Life II Theories ofOrigin of LifeBy Aarushi Ma&#39;amBiology,0,0,0,0.0,2025-08-20 13:09:38,YouTube,,jlV_FeWeQ2g,YouTube,,0
Evolution Of Elephants  | #evolution #elephant #shorts,3,0,0,3.0,2025-08-20 12:45:17,YouTube,,N4B_4Da_smc,YouTube,,3
Will Quantum Computing Transform Neurotech Research? - Neurotech Insight Pro,0,0,0,0.0,2025-08-21 01:21:01,YouTube,,azq8MbvQB_8,YouTube,,0
Quantum Computing 2025: The Ocelot vs Microsofts Qubit Breakthrough,0,0,0,0.0,2025-08-21 00:58:48,YouTube,,2qD3tmAHo6U,YouTube,,0
The wonders of Quantum AI,0,0,0,0.0,2025-08-21 00:34:28,YouTube,,lsZH9TzIKns,YouTube,,0
Unveiling Tensor Networks: A Quantum Computing Revolution,0,0,0,0.0,2025-08-20 22:19:28,YouTube,,JEwRdxAQZsg,YouTube,,0
Can Quantum Computing Improve Cybersecurity? - International Policy Zone,0,0,0,0.0,2025-08-20 21:53:35,YouTube,,r1G2QrpgCY0,YouTube,,0
Quantum Computers vs. Your Laptop: The Future is Now! #trending #motivation #ai,0,0,0,0.0,2025-08-20 21:02:09,YouTube,,gTMbMQZALOs,YouTube,,0
Quantum Computer,1,0,0,1.0,2025-08-20 20:44:28,YouTube,,0jA3olv99nY,YouTube,,1
How Can I Learn More About Serverless Quantum Computing? - Emerging Tech Insider,0,0,0,0.0,2025-08-20 20:36:05,YouTube,,raxevXOglPs,YouTube,,0
Quantum Computing Explained Simply,1,0,0,1.0,2025-08-20 20:22:00,YouTube,,DTYb7d_RAXQ,YouTube,,1
Unlocking Quantum Power: How Tensor Networks Are Revolutionizing Quantum Computing,0,0,0,0.0,2025-08-20 20:08:26,YouTube,,t-9j9DxT9dQ,YouTube,,0
Data Safety in the Quantum Computing Age: How to Stay Secure,0,0,0,0.0,2025-08-20 20:00:14,YouTube,,pMR0fbs3ZHg,YouTube,,0
Quantum Computing Revolution: Rigetti and MSU&#39;s Cutting-Edge Research,0,0,0,0.0,2025-08-20 19:27:24,YouTube,,3758smfcirI,YouTube,,0
Quantum Computing Stocks: The Race for Patent Dominance,0,0,0,0.0,2025-08-20 19:10:41,YouTube,,I8_tvhawYWM,YouTube,,0
Quantum computing will destroy the blockchain,0,0,0,0.0,2025-08-20 19:00:10,YouTube,,5KPuR11xxTs,YouTube,,0
Quantum Computing Revolution Explained,0,0,0,0.0,2025-08-20 18:48:46,YouTube,,1-2BuUq3znc,YouTube,,0
The parrot sits on the tree and enjoys drinking juice #ai #shorts #video #parrot,7,0,0,7.0,2025-08-21 01:21:51,YouTube,,I4uOZo5xGuA,YouTube,,7
just for Fun #funny #viral #comedy #trending #shorts #podcast #ai#facts#motivation,0,0,0,0.0,2025-08-21 01:18:56,YouTube,,2_viDidePLs,YouTube,,0
mysterious bike race  #ai #india #pakistan #shortvideo,0,0,0,0.0,2025-08-21 01:18:35,YouTube,,0r8ogexoZag,YouTube,,0
# #aI #ai,11,1,0,12.0,2025-08-21 01:08:56,YouTube,,nw0S6_C47kg,YouTube,,12
&#39;&#39;   AI  Morning Brief 21/08/2025,155,0,0,155.0,2025-08-21 00:56:36,YouTube,,3ngiMPlq4xU,YouTube,,155
#ai #shortvideos #dog,11,0,0,11.0,2025-08-21 00:44:09,YouTube,,-PgvO-plRJ4,YouTube,,11
This AI Indicator Predicts All Market Movements | ChatGPT-Powered Trading Tool,252,0,0,252.0,2025-08-21 00:16:15,YouTube,,mJX6DZhTy5o,YouTube,,252
"LIVE- Trump&#39;s Economic RESET, AI Land Grabs, Radioactive Shrimp Warning &amp; More!  UWN - 8/20/25",320,0,0,320.0,2025-08-21 00:16:25,YouTube,,_tnGKQMBA28,YouTube,,320
Ranking Funny Baby Ai Videos,89,2,0,91.0,2025-08-21 00:00:33,YouTube,,aevFKHHYyMw,YouTube,,91
V thi X Ngh qu i | AI Cover,19,0,0,19.0,2025-08-20 23:22:46,YouTube,,FvLY__tlf9s,YouTube,,19
