content,likes,comments,shares,Engagement_Score,timestamp,Platform,author,post_id,platform,Quotes,engagement_score
Rainbow Cat&#39;s Mischief Crashing Cat Mom #ai #story #catshorts#aicat #funnymeow8#funnycat#aicat,165,1,0,166.0,2025-09-01 16:03:26,YouTube,,oKBeFjM0Yw8,YouTube,,166
What Are The Different Theories Of Hominin Evolution? - The Wild Life Explorer,0,0,0,0.0,2025-09-02 00:22:00,YouTube,,GfBtK9f-Un0,YouTube,,0
Evolution Unleashed  How One Theory Transformed Biology Forever,0,0,0,0.0,2025-09-02 00:15:07,YouTube,,mbEdyz6QLRo,YouTube,,0
Chaos theory epic evolution ceratosaurus review,1,0,0,1.0,2025-09-01 21:22:07,YouTube,,0EyCWyForY4,YouTube,,1
Chaos theory epic evolution Parasaurolophus review,1,0,0,1.0,2025-09-01 21:22:24,YouTube,,4so1lzQfS-g,YouTube,,1
THE TRUTH ABOUT EVOLUTION AND OUR ORIGINS REVEALED!,4,0,0,4.0,2025-09-01 20:08:54,YouTube,,A7cBXyyqzKU,YouTube,,4
THE TRUTH ABOUT EVOLUTION AND OUR ORIGINS REVEALED!,17,2,0,19.0,2025-09-01 20:09:07,YouTube,,gwkS5otsDCw,YouTube,,19
The Missing Piece of Evolutionary Theory,3,3,0,6.0,2025-09-01 15:27:56,YouTube,,wd5gb9cRCi0,YouTube,,6
The Theory of Evolution | Fact or Fiction | #shorts,0,0,0,0.0,2025-09-01 14:03:55,YouTube,,nk6kZNNAdkU,YouTube,,0
Theory of Evolution Explained | Darwins Idea | Science Shorts #shorts #shortsfeed #ytshorts #viral,0,0,0,0.0,2025-09-01 13:48:55,YouTube,,jzBYyztnwro,YouTube,,0
"&quot;Theory of Imitation in Literary Criticism: Origins, Evolution, and Influence",0,0,0,0.0,2025-09-01 12:48:04,YouTube,,aC24kSwnp2I,YouTube,,0
Gary Brecka - The Problem With the Theory of Evolution,0,0,0,0.0,2025-09-01 12:44:16,YouTube,,Q-cimvupn1Y,YouTube,,0
Dinosaurs STILL Alive? Crazy Theory Challenges Evolution!,0,0,0,0.0,2025-09-01 11:55:43,YouTube,,HRCB5IA2FTI,YouTube,,0
Making The T-Rex!!! - Jurassic World Evolution 2 Chaos Theory playthrough #2,2,0,0,2.0,2025-09-01 04:52:44,YouTube,,y7MTjBxsywA,YouTube,,2
(Mutation theory) | utparivartan vad || mutation theory of evolution by hugo de vries,1,0,0,1.0,2025-09-01 04:30:13,YouTube,,FeaOVr8SKpE,YouTube,,1
Jurassic World Evolution 2_Chaos Theory Jurassic World pt. Last,0,0,0,0.0,2025-09-01 04:05:04,YouTube,,9Z_vuBp1InU,YouTube,,0
Bitcoin vs Quantum: Is the Future of Crypto Already at Risk?,0,0,0,0.0,2025-09-02 06:22:57,YouTube,,uI_pb0NJrkE,YouTube,,0
Quantum Computing is NOW! Get Ready for Electrical Engineers!,0,0,0,0.0,2025-09-02 05:57:29,YouTube,,7c8193chSG8,YouTube,,0
The Future of Entrepreneurship: AI Meets Quantum Computing - Gary Fowler &amp; Nick Laursen,0,0,0,0.0,2025-09-02 05:49:22,YouTube,,r-Rsn58gK0k,YouTube,,0
Quantum Computing Explained: The Future of Tech Is Here,0,0,0,0.0,2025-09-02 04:53:34,YouTube,,Q_IDXeo6D7g,YouTube,,0
Austria&#39;s Quantum Strategy,0,0,0,0.0,2025-09-02 04:03:31,YouTube,,0k22tod2tcs,YouTube,,0
Quantum Computing: Perfecting Renewable Energy&#39;s Timing #shorts,0,0,0,0.0,2025-09-02 04:01:31,YouTube,,EIJNR5AM5lc,YouTube,,0
South Africa Quantum Computing Forecast,0,0,0,0.0,2025-09-02 04:00:06,YouTube,,UARrLttF5XI,YouTube,,0
Canada Quantum Computing Forecast,0,0,0,0.0,2025-09-02 04:00:06,YouTube,,RRZS5fnXX4E,YouTube,,0
Basics of quantum mechanics and quantum computing principle,0,0,0,0.0,2025-09-02 02:52:42,YouTube,,lJMRDgst6Vw,YouTube,,0
Quantum Computing &amp; Programming | Future of Technology Explained,0,0,0,0.0,2025-09-02 02:30:32,YouTube,,XvxTuIJ5_kU,YouTube,,0
Are Quantum computers coming for our bags?!,2,1,0,3.0,2025-09-02 02:19:17,YouTube,,oYlK11yfIl0,YouTube,,3
Basics of quantum mechanics and quantum computing principle,1,0,0,1.0,2025-09-02 01:36:52,YouTube,,4O61my5ahbQ,YouTube,,1
How Will Quantum Computers Use Cryogen-free Cooling? - Quantum Tech Explained,0,0,0,0.0,2025-09-02 01:06:56,YouTube,,vfhtPchrOig,YouTube,,0
Top 15  New Quantum Computing Breakthroughs (So Far),74,8,0,82.0,2025-09-02 00:37:08,YouTube,,EQM25seTqO4,YouTube,,82
Why Is Quantum Computing For Neuroscience So Complex? - Neurotech Insight Pro,0,0,0,0.0,2025-09-02 00:36:53,YouTube,,nZpDVDwB8RA,YouTube,,0
From Tears to Treasure: A Fishermans Magical Journey #ai#baby #aishorts# Pyari Billi#emotional stor,5,0,0,5.0,2025-09-02 05:53:51,YouTube,,wyPX0JMN8eM,YouTube,,5
Buffalo covered by dangerous snakes  rescued by rescuers #ai #cow #rescue #snake,12,0,0,12.0,2025-09-02 05:35:12,YouTube,,Xk6EJtcLinI,YouTube,,12
Ai shorts Cute Baby Dance #babyshorts #baby #ai #techartgenius #viralvideos #aishorts,5,0,0,5.0,2025-09-02 05:24:41,YouTube,,7YqEXCuwJQ4,YouTube,,5
Ai shorts Cute Baby Dance #babyshorts #baby #ai #techartgenius #viralvideos #aishorts,5,0,0,5.0,2025-09-02 04:39:16,YouTube,,l-7cKA5b_e8,YouTube,,5
AI 22 6364+,18,1,0,19.0,2025-09-02 04:01:26,YouTube,,R6OkW_9bNQo,YouTube,,19
#Comfyui #AI #ai #ai singer #Q version star,6,0,0,6.0,2025-09-02 03:57:09,YouTube,,LZuxowfBRCU,YouTube,,6
robot ladki se pyar #shorts #youtubeshorts #viral #trending #ai #explore,6,0,0,6.0,2025-09-02 03:52:53,YouTube,,X_WPMUjo8xo,YouTube,,6
#AI #AI #AI # #Al,61,0,0,61.0,2025-09-02 03:07:26,YouTube,,kYBAf5mzhjw,YouTube,,61
"Indian Army lady rescued baby birds from fire, fed strays too #ai #army #facts",22,0,0,22.0,2025-09-02 03:06:45,YouTube,,segpBEo0nb4,YouTube,,22
Heavy Tractor Working ln The Field #tractor #automobile #agriculture #shots #ai #viral #technology,0,0,0,0.0,2025-09-02 00:15:41,YouTube,,-ZyP3Z7TJTE,YouTube,,0
Lord Shiva Works in Silence - Do You Notice? #spirituality #buddha#blessed #ai#sakyamuni #help #ail,839,1,0,840.0,2025-09-01 23:03:16,YouTube,,oc5NbbcnPz4,YouTube,,840
Microsoft New AI is 100X More Intelligent Than DeepSeek R1,829,84,0,913.0,2025-09-01 22:15:33,YouTube,,2ZrGu2zZL_A,YouTube,,913
From Strings to the Heart #slash #gunsnroses #ai #music,49,0,0,49.0,2025-09-01 20:21:07,YouTube,,zbzcaZNq7lg,YouTube,,49
Volleyball Player Steals the Spotlight with Dance #ai #volleyball #tall,23,1,0,24.0,2025-09-01 17:27:23,YouTube,,87yJx7yGc5Q,YouTube,,24
Generative AI &amp; ML Full Course 2025 | Gen AI&amp;ML Tutorial for Beginners | Gen AI Explained | Edureka,189,0,0,189.0,2025-09-01 17:13:36,YouTube,,Km4cSK8VLZ4,YouTube,,189
The Evolution of Humans,2,0,0,2.0,2025-09-02 04:29:25,YouTube,,YFjP_yfTcL4,YouTube,,2
What Are The Different Theories Of Hominin Evolution? - The Wild Life Explorer,0,0,0,0.0,2025-09-02 00:22:00,YouTube,,GfBtK9f-Un0,YouTube,,0
Evolution Unleashed  How One Theory Transformed Biology Forever,0,0,0,0.0,2025-09-02 00:15:07,YouTube,,mbEdyz6QLRo,YouTube,,0
Chaos theory epic evolution ceratosaurus review,1,0,0,1.0,2025-09-01 21:22:07,YouTube,,0EyCWyForY4,YouTube,,1
Chaos theory epic evolution Parasaurolophus review,1,0,0,1.0,2025-09-01 21:22:24,YouTube,,4so1lzQfS-g,YouTube,,1
THE TRUTH ABOUT EVOLUTION AND OUR ORIGINS REVEALED!,5,0,0,5.0,2025-09-01 20:08:54,YouTube,,A7cBXyyqzKU,YouTube,,5
The Missing Piece of Evolutionary Theory,4,3,0,7.0,2025-09-01 15:27:56,YouTube,,wd5gb9cRCi0,YouTube,,7
The Theory of Evolution | Fact or Fiction | #shorts,0,0,0,0.0,2025-09-01 14:03:55,YouTube,,nk6kZNNAdkU,YouTube,,0
Theory of Evolution Explained | Darwins Idea | Science Shorts #shorts #shortsfeed #ytshorts #viral,1,1,0,2.0,2025-09-01 13:48:55,YouTube,,jzBYyztnwro,YouTube,,2
"&quot;Theory of Imitation in Literary Criticism: Origins, Evolution, and Influence",0,0,0,0.0,2025-09-01 12:48:04,YouTube,,aC24kSwnp2I,YouTube,,0
Gary Brecka - The Problem With the Theory of Evolution,0,0,0,0.0,2025-09-01 12:44:16,YouTube,,Q-cimvupn1Y,YouTube,,0
Dinosaurs STILL Alive? Crazy Theory Challenges Evolution!,0,0,0,0.0,2025-09-01 11:55:43,YouTube,,HRCB5IA2FTI,YouTube,,0
Making The T-Rex!!! - Jurassic World Evolution 2 Chaos Theory playthrough #2,2,0,0,2.0,2025-09-01 04:52:44,YouTube,,y7MTjBxsywA,YouTube,,2
(Mutation theory) | utparivartan vad || mutation theory of evolution by hugo de vries,1,0,0,1.0,2025-09-01 04:30:13,YouTube,,FeaOVr8SKpE,YouTube,,1
Jurassic World Evolution 2_Chaos Theory Jurassic World pt. Last,0,0,0,0.0,2025-09-01 04:05:04,YouTube,,9Z_vuBp1InU,YouTube,,0
What Are The Biggest Challenges In Quantum Computing Development? - Emerging Tech Insider,0,0,0,0.0,2025-09-02 12:31:28,YouTube,,RbaouHklFpU,YouTube,,0
Quantum Computing University in Outer Space Captions  Learn English Through Fun english vocabulary,0,0,0,0.0,2025-09-02 12:00:04,YouTube,,agEU6i6a8A4,YouTube,,0
Day-14 QT-00 &amp; 01 Foundations of Quantum Computing and Applications,0,0,0,0.0,2025-09-02 11:50:18,YouTube,,uaVBrCA24R8,YouTube,,0
Quantum Computing Stock: Should You Invest Now? | Expert Analysis,0,0,0,0.0,2025-09-02 11:38:16,YouTube,,RIzBG-mAbwI,YouTube,,0
Are Quantum Computing Stocks Overvalued? - Emerging Tech Insider,0,0,0,0.0,2025-09-02 11:26:22,YouTube,,TXB9P255eQE,YouTube,,0
Quantum Computing&#39;s UK Career Revolution,2,0,0,2.0,2025-09-02 11:01:19,YouTube,,m4z2HHCfF8M,YouTube,,2
Why Is Code Distance Crucial For Robust Quantum Computing? - Quantum Tech Explained,0,0,0,0.0,2025-09-02 10:31:19,YouTube,,0jLah8GuJAo,YouTube,,0
Neoteric frontiers in cloud and quantum computing,2,0,0,2.0,2025-09-02 10:22:48,YouTube,,_vo3x7grVTs,YouTube,,2
Why Is Quantum Error Correction Crucial For Real-world Quantum Computers? - Quantum Tech Explained,0,0,0,0.0,2025-09-02 09:26:25,YouTube,,7MXxAURtAGs,YouTube,,0
,0,0,0,0.0,2025-09-02 09:20:42,YouTube,,dc2jQKC5tJM,YouTube,,0
Sweden Quantum Computing as of August 2025,0,0,0,0.0,2025-09-02 09:00:06,YouTube,,kZWV3irBnSg,YouTube,,0
Why Is Quantum Computing Vital For Computational Drug Discovery? - Quantum Tech Explained,0,0,0,0.0,2025-09-02 08:53:59,YouTube,,CGpw5sCJyUM,YouTube,,0
QUBT Stock (Quantum Computing stock) QUBT STOCK PREDICTION QUBT STOCK analysis QUBT stock news,0,0,0,0.0,2025-09-02 08:29:03,YouTube,,mVZXAWOno9M,YouTube,,0
Differences between classical and quantum computing,0,0,0,0.0,2025-09-02 08:30:14,YouTube,,_ixtrAKfG8o,YouTube,,0
Why Quantum Computing Will Change Everything,0,0,0,0.0,2025-09-02 08:07:31,YouTube,,cFj8XJbclXQ,YouTube,,0
Indian vs Pakistani Women Flying with Magical Umbrellas #ai #india #pakistan,4,0,0,4.0,2025-09-02 12:24:43,YouTube,,4VnnQKJpQGE,YouTube,,4
Cute Maxico Plush Dancing Cactus Electric Plush Toy #short #animation #ai #cutebaby #cute,14,0,0,14.0,2025-09-02 12:18:38,YouTube,,XsmYwumLyYQ,YouTube,,14
AI Takes Over Cinema: But Gets Everything Hilariously Wrong!,2,0,0,2.0,2025-09-02 11:33:53,YouTube,,esgyAi2EKTM,YouTube,,2
#ai #cet  cartoon video #tamilsongs #indiansongs #arrahman,3,0,0,3.0,2025-09-02 11:24:48,YouTube,,8D6HRU6mV-E,YouTube,,3
#ai #shorts #catshorts,46,0,0,46.0,2025-09-02 11:03:00,YouTube,,2I9A58VxpOo,YouTube,,46
"Death Was Near... The Bull Pleaded, Vishnu Appeared #ai #Cow #lordkrishna #Shorts #youtubeshorts",6,0,0,6.0,2025-09-02 10:54:33,YouTube,,cKFtJ4Wra20,YouTube,,6
AI#ai # # #,3,0,0,3.0,2025-09-02 09:42:33,YouTube,,1wgwHO8mJeE,YouTube,,3
Ronaldo Ishowspeed Georgina Ai edit 20#ronaldo #ishowspeed #ai #edit #funny #memes #football#shorts,28,0,0,28.0,2025-09-02 09:24:24,YouTube,,CuiDLMlUMa8,YouTube,,28
"Chacha Chaudhary , Sabu vs The Fire Demon Dinosaur#ai #story #shorts #viral #horror #cartoon #ganesh",6,0,0,6.0,2025-09-02 09:13:49,YouTube,,Luk4bXgeWyQ,YouTube,,6
Gemini AI,2,0,0,2.0,2025-09-02 09:05:08,YouTube,,W0KSFhkn_94,YouTube,,2
How Power Instinct Characters Would Look in Real Life with AI,63,1,0,64.0,2025-09-02 08:10:02,YouTube,,oua3kjHbmbA,YouTube,,64
Ai shorts Cute Baby Dance #babyshorts #baby #ai #techartgenius #viralvideos #aishorts,3,0,0,3.0,2025-09-02 05:25:32,YouTube,,uIGsaw_mu1Y,YouTube,,3
#AI #AI #AI # #Al,193,0,0,193.0,2025-09-02 03:07:26,YouTube,,kYBAf5mzhjw,YouTube,,193
One Way- Choo Choo Train- TanjaThomas #lyricsvideo #englishsongs #shorts #ai,406,4,0,410.0,2025-09-02 03:00:18,YouTube,,Ek1mqHGmi_A,YouTube,,410
CLASS101xEasyGPT 9/2() 8PM AI   600      | EasyGPT,70,0,0,70.0,2025-09-02 02:07:34,YouTube,,Iwzoj6drYUg,YouTube,,70
Theory of Evolution: Facts vs Fiction | How Life Began on Earth,0,0,0,0.0,2025-09-02 12:31:06,YouTube,,lIIU7Ug_0tg,YouTube,,0
Darwins Theory of Evolution Exposed | Sheykh Powerful Debate | Uthman Ibn Farooq Official,10,4,0,14.0,2025-09-02 11:00:40,YouTube,,N9siPE91i0E,YouTube,,14
Darwin ki Evolution Theory | kya Insaan Bandar Se Aaya Hai | Itz Aman,1,0,0,1.0,2025-09-02 10:16:15,YouTube,,rlp6MY4eckE,YouTube,,1
evolution of spiderman #spiderman #sirenheadhulk #avengersforever #shorts,12,0,0,12.0,2025-09-02 10:01:11,YouTube,,f3iTQ5nqdPY,YouTube,,12
The Theory of Evolution | Fact vs Fiction #shorts,0,0,0,0.0,2025-09-02 08:51:24,YouTube,,RZwiLMPUmNQ,YouTube,,0
Do You Know How Humans Evolved?,3,0,0,3.0,2025-09-02 04:29:25,YouTube,,YFjP_yfTcL4,YouTube,,3
What Are The Different Theories Of Hominin Evolution? - The Wild Life Explorer,0,0,0,0.0,2025-09-02 00:22:00,YouTube,,GfBtK9f-Un0,YouTube,,0
Evolution Unleashed  How One Theory Transformed Biology Forever,0,0,0,0.0,2025-09-02 00:15:07,YouTube,,mbEdyz6QLRo,YouTube,,0
Chaos theory epic evolution ceratosaurus review,1,0,0,1.0,2025-09-01 21:22:07,YouTube,,0EyCWyForY4,YouTube,,1
Chaos theory epic evolution Parasaurolophus review,1,0,0,1.0,2025-09-01 21:22:24,YouTube,,4so1lzQfS-g,YouTube,,1
THE TRUTH ABOUT EVOLUTION AND OUR ORIGINS REVEALED!,5,0,0,5.0,2025-09-01 20:08:54,YouTube,,A7cBXyyqzKU,YouTube,,5
Agassiz vs. Darwin on #naturalselection #evolution #nature #biology #philosophy #quotes #debate,35,9,0,44.0,2025-09-01 18:25:01,YouTube,,zmepMw6qnhs,YouTube,,44
What Really Happened Before Humans Existed - From Apes to Cavemen - Evolution theory,0,0,0,0.0,2025-09-01 17:08:57,YouTube,,NfUKTvxrWeY,YouTube,,0
The Missing Piece of Evolutionary Theory,4,3,0,7.0,2025-09-01 15:27:56,YouTube,,wd5gb9cRCi0,YouTube,,7
Theory of Evolution Explained | Darwins Idea | Science Shorts #shorts #shortsfeed #ytshorts #viral,1,1,0,2.0,2025-09-01 13:48:55,YouTube,,jzBYyztnwro,YouTube,,2
Why Are Quantum Labs Yellow??,57,1,0,58.0,2025-09-02 18:13:12,YouTube,,gashgnF4a7I,YouTube,,58
Quantum Breakthrough: Heavy Fermions and the Future of Quantum Computing,0,0,0,0.0,2025-09-02 17:59:07,YouTube,,nd84bgvg7Fk,YouTube,,0
Heavy Electrons Hold the Key to a New Type of Quantum Computer,0,0,0,0.0,2025-09-02 17:54:49,YouTube,,vLAE4Y92lOA,YouTube,,0
Quantum Computing Is About To CHANGE Your Life!,0,0,0,0.0,2025-09-02 17:35:07,YouTube,,2xPO-1k63MQ,YouTube,,0
Discover the power of quantum computing! #QuantumComputing #TechInnovation #Inspiration,0,0,0,0.0,2025-09-02 17:34:50,YouTube,,WbVvJuJLpqI,YouTube,,0
$34M Investment in Phasecraft: Quantum Computing Breakthroughs Explained,0,0,0,0.0,2025-09-02 17:29:04,YouTube,,VOcWYCOPSqw,YouTube,,0
Quantum Computing Stocks: Bullish Trends &amp; What It Means for Investors,0,0,0,0.0,2025-09-02 17:25:38,YouTube,,PFVyvjm7wRM,YouTube,,0
How Will Quantum Computing Affect Blockchain Cybersecurity? - All About Crypto Exchanges,0,0,0,0.0,2025-09-02 17:06:36,YouTube,,IA7Slqf9eVg,YouTube,,0
Quantum Computing: From Sci-Fi to National Priority! #shorts,1,0,0,1.0,2025-09-02 15:48:52,YouTube,,H5dTr2o-zHo,YouTube,,1
The Rise of Quantum Computing : How Quantum Computing is Transforming Our Future!,1,1,0,2.0,2025-09-02 15:47:27,YouTube,,8GF70jXNV4I,YouTube,,2
Day 2 of learning quantum computing,0,0,0,0.0,2025-09-02 15:37:31,YouTube,,XVSqsKstwkg,YouTube,,0
Quantum computing,0,0,0,0.0,2025-09-02 15:28:16,YouTube,,FrTgDSTCBEA,YouTube,,0
Trump&#39;s Role in Quantum Computing  Trump&#39;s stance on quantum computing has been a subject of deb,0,1,0,1.0,2025-09-02 15:09:02,YouTube,,PgjA2U_yNd4,YouTube,,1
"The Quantum Computing Race Explained  IBM, Google &amp; Startups Compete!",0,0,0,0.0,2025-09-02 15:00:33,YouTube,,G-g7kbxpKkc,YouTube,,0
How Is Quantum Computing Transforming Drug Discovery? - Quantum Tech Explained,0,0,0,0.0,2025-09-02 14:50:54,YouTube,,sE-tFYQoZrs,YouTube,,0
#   #shorts#trending#devotionalsongs#traditional#viral#ai#god#ammansongs,55,0,0,55.0,2025-09-02 17:04:38,YouTube,,btYMpExlwb0,YouTube,,55
"The Bitcoin-AI Revolution: Power, Profit, and the Planets Future",89,28,0,117.0,2025-09-02 16:41:50,YouTube,,_KcXC9yanFo,YouTube,,117
#ai #trending #youtuber #trend#youtubeshorts #vairal #cartoon,11,0,0,11.0,2025-09-02 16:38:49,YouTube,,S-Y7gos9S1c,YouTube,,11
Volleyball Player Steals the Spotlight with Dance #ai #volleyball #tall,7,0,0,7.0,2025-09-02 16:36:15,YouTube,,xEZDGipWNI8,YouTube,,7
AI5,11,0,0,11.0,2025-09-02 16:28:41,YouTube,,tuSu6k3B_s0,YouTube,,11
Squirrel cartoon video #ai #cartoon #cartoonvideo #cartoonforkids #squirrel #aivideo,9,0,0,9.0,2025-09-02 16:14:02,YouTube,,M6wB4sELfA4,YouTube,,9
poor cat gets rich#shorts #youtubeshorts #aivideo #aicatvideo #ai,18,0,0,18.0,2025-09-02 15:16:00,YouTube,,_o2Bf3dipSQ,YouTube,,18
Evolution of Iran  #film #ai #history #evolution #historysaga,23,0,0,23.0,2025-09-02 15:08:34,YouTube,,eOVfXRJeQ6Q,YouTube,,23
Trusta.AI (TA)  300%  !,3,1,0,4.0,2025-09-02 14:33:42,YouTube,,6U2gEZsjfhM,YouTube,,4
Apples Big AI Shift: Siri Meets ChatGPT and Gemini | Facts | AI | Shorts #iphone #tech #ai,18,1,0,19.0,2025-09-02 14:01:35,YouTube,,CFluPWcOtJU,YouTube,,19
The Desert Adventure: Grandpa &amp; Parrot&#39;s Epic Water Quest!#mrbeast #ai,66,0,0,66.0,2025-09-02 13:28:46,YouTube,,kF1i899CLRU,YouTube,,66
Sawariya kar do beda paar  Soulful Devotional Song bhajan vibes #ai #song,100,0,0,100.0,2025-09-02 13:15:56,YouTube,,YQfLOUDIkxA,YouTube,,100
7 ORANG TALENT LAGI AI TEAM DIRELEASE !!! AI TEAM RINDU,28845,2005,0,30850.0,2025-09-02 12:28:06,YouTube,,GxueE8funxw,YouTube,,30850
Indian vs Pakistani Women Flying with Magical Umbrellas #ai #india #pakistan,62,0,0,62.0,2025-09-02 12:24:43,YouTube,,4VnnQKJpQGE,YouTube,,62
Cute Maxico Plush Dancing Cactus Electric Plush Toy #short #animation #ai #cutebaby #cute,225,0,0,225.0,2025-09-02 12:18:38,YouTube,,XsmYwumLyYQ,YouTube,,225
&quot; Darwin      Evolution Theory?&quot;,2,1,0,3.0,2025-09-02 17:05:45,YouTube,,WM3Ke3QFMy8,YouTube,,3
Jurassic World Evolution 2 - Chaos Theory: Return to Isla Nublar (Ep. 01),0,0,0,0.0,2025-09-02 16:30:25,YouTube,,vhqOCgLdo98,YouTube,,0
Evolutionary theory of culture wars,8,2,0,10.0,2025-09-02 16:23:45,YouTube,,WEa3ZTvIjG0,YouTube,,10
The Evolution Of Mortimer Goth (Based on Sims Theory) #TheSims4  #TheSims2 #TheSims3 #MortimerGoth,2,0,0,2.0,2025-09-02 15:52:24,YouTube,,C_TzF7J2QrQ,YouTube,,2
Evolution - Theories Of Evolution - NEET NCERT Biology @bioneetirrg,3,0,0,3.0,2025-09-02 15:45:06,YouTube,,wZn2EB07jgc,YouTube,,3
Chicken T-rex Theory #evolutiongonewrong,41,0,0,41.0,2025-09-02 14:33:47,YouTube,,aSrXvh3YvZs,YouTube,,41
evolution theory,0,0,0,0.0,2025-09-02 13:13:35,YouTube,,VUPjFECicoc,YouTube,,0
Theory of Evolution: Facts vs Fiction | How Life Began on Earth,0,0,0,0.0,2025-09-02 12:31:06,YouTube,,lIIU7Ug_0tg,YouTube,,0
Darwins Theory of Evolution Exposed | Sheykh Powerful Debate | Uthman Ibn Farooq Official,34,6,0,40.0,2025-09-02 11:00:40,YouTube,,N9siPE91i0E,YouTube,,40
Darwin ki Evolution Theory | kya Insaan Bandar Se Aaya Hai | Itz Aman,1,0,0,1.0,2025-09-02 10:16:15,YouTube,,rlp6MY4eckE,YouTube,,1
evolution of spiderman #spiderman #sirenheadhulk #avengersforever #shorts,50,0,0,50.0,2025-09-02 10:01:11,YouTube,,f3iTQ5nqdPY,YouTube,,50
The Theory of Evolution | Fact vs Fiction #shorts,0,0,0,0.0,2025-09-02 08:51:24,YouTube,,RZwiLMPUmNQ,YouTube,,0
Human Evolution History!!!!,3,0,0,3.0,2025-09-02 04:29:25,YouTube,,YFjP_yfTcL4,YouTube,,3
What Are The Different Theories Of Hominin Evolution? - The Wild Life Explorer,0,0,0,0.0,2025-09-02 00:22:00,YouTube,,GfBtK9f-Un0,YouTube,,0
Evolution Unleashed  How One Theory Transformed Biology Forever,0,0,0,0.0,2025-09-02 00:15:07,YouTube,,mbEdyz6QLRo,YouTube,,0
"The Future of Mathematics: AI, Quantum Computing, and Beyond",0,1,0,1.0,2025-09-03 01:00:54,YouTube,,mYSMXIfP7-E,YouTube,,1
Factor Ciencia - El poder de lo cuntico a prueba de hackers (02/09/2025),15,0,0,15.0,2025-09-03 00:30:06,YouTube,,9Zy6F5O532M,YouTube,,15
Is Bitcoin Unstoppable? Quantum Threats and Market Predictions | Roxom News,0,1,0,1.0,2025-09-02 23:35:48,YouTube,,ZE6nv4mHKBw,YouTube,,1
Bitcoin at Risk? Quantum Computing Threats and the Future of Crypto | RoxomTV,0,0,0,0.0,2025-09-02 23:34:09,YouTube,,_diwDSRVw3M,YouTube,,0
Can Quantum Computing Shorten Drug Discovery Timelines? - Quantum Tech Explained,0,0,0,0.0,2025-09-02 22:57:38,YouTube,,IhN1h9RDsJw,YouTube,,0
WisdomTree&#39;s Quantum Computing ETF: Exploring the Future of Technology,0,0,0,0.0,2025-09-02 21:29:28,YouTube,,vWhvN9Urbxw,YouTube,,0
First Look at a Real Quantum Computer! Mind-Blowing Tech! #shorts,5,0,0,5.0,2025-09-02 21:01:31,YouTube,,1pBeLoIxuOA,YouTube,,5
First Look at a Real Quantum Computer! Mind-Blowing Tech! #shorts,6,1,0,7.0,2025-09-02 21:00:32,YouTube,,zqwdwRlVtPA,YouTube,,7
First Look at a Real Quantum Computer! Mind-Blowing Tech! #shorts,1,0,0,1.0,2025-09-02 20:58:31,YouTube,,Xxo4RJqitdk,YouTube,,1
First Look at a Real Quantum Computer! Mind-Blowing Tech! #shorts,0,0,0,0.0,2025-09-02 20:55:42,YouTube,,l20rXZIhiw8,YouTube,,0
Bristol-Based Phasecraft Raises $34M to Accelerate Quantum Computing R&amp;D | Total Funding Over $50M,0,0,0,0.0,2025-09-02 20:32:09,YouTube,,_efrVlbDVSI,YouTube,,0
"Quantum Computing Breakthroughs: Scalability, Applications, and the Future of Tech",0,0,0,0.0,2025-09-02 20:26:36,YouTube,,InKedzv7NF8,YouTube,,0
Phasecraft Raises $34M to Revolutionize Quantum Computing: What It Means for the Future,0,0,0,0.0,2025-09-02 20:21:40,YouTube,,2HJ6FShPWno,YouTube,,0
Why Quantum Computers Will Change Everything #QuantumComputing #TechExplained #viral #shorts,0,0,0,0.0,2025-09-02 19:00:46,YouTube,,q3HbwPcj1OQ,YouTube,,0
3 Best Quantum Computing Stocks To Buy In September 2025!,1,0,0,1.0,2025-09-02 18:50:28,YouTube,,NDw2qg8FoW4,YouTube,,1
Rescue  Dragon in large log #shorts#ai #aiart #pik  #funny,5,0,0,5.0,2025-09-03 00:39:53,YouTube,,Rt78K-cSfmc,YouTube,,5
"[AI]   &#39;  &#39;   | 45 , 70 &#39; &#39;    | SBS",105,0,0,105.0,2025-09-03 00:16:37,YouTube,,Vmy-VJLcgpg,YouTube,,105
Kitaguni No Haru - Teresa Teng #ai#aiart#song#teresateng #popular,0,0,0,0.0,2025-09-02 22:45:20,YouTube,,O40Uos5Q5hQ,YouTube,,0
Ronaldo Ishowspeed Georgina Ai edit #ronaldo #ishowspeed #ai #edit #funny #memes #football #shorts,25,0,0,25.0,2025-09-02 16:22:05,YouTube,,BIvA52hmozQ,YouTube,,25
funny dance video #ai #aidance  #shorts #shortsfeed #catlovers #catshorts #catmemes  #viralvideo,164,0,0,164.0,2025-09-02 15:04:21,YouTube,,AQ0XJfMWqQA,YouTube,,164
The Desert Adventure: Grandpa &amp; Parrot&#39;s Epic Water Quest!#mrbeast #ai,90,0,0,90.0,2025-09-02 13:28:46,YouTube,,kF1i899CLRU,YouTube,,90
7 ORANG TALENT LAGI AI TEAM DIRELEASE !!! AI TEAM RINDU,32475,2233,0,34708.0,2025-09-02 12:28:06,YouTube,,GxueE8funxw,YouTube,,34708
Cute Maxico Plush Dancing Cactus Electric Plush Toy #short #animation #ai #cutebaby #cute,231,0,0,231.0,2025-09-02 12:18:38,YouTube,,XsmYwumLyYQ,YouTube,,231
AI TEAM QUIZZ SEMPENA KEMERDEKAAN !!!,4646,186,0,4832.0,2025-09-02 12:00:53,YouTube,,PzU8YO3m8yg,YouTube,,4832
Cute Ai animation squidgame mukbang colorfull bread #cute #ai #storytime #asmr #cuteanimation,33,0,0,33.0,2025-09-02 12:01:55,YouTube,,B5y37tQlZfU,YouTube,,33
AI in classrooms: Khan Academy CEO Salman Khan on the future of AI in education,231,47,0,278.0,2025-09-02 11:43:10,YouTube,,Ey897fuIJDQ,YouTube,,278
BABY EL PILIH HADIAH UNTUK BABY TWINS ! KENA UGUT TAK BAGI SUSU,6860,251,0,7111.0,2025-09-02 11:22:53,YouTube,,YLxEecg8xHE,YouTube,,7111
#ai #shorts #catshorts,172,0,0,172.0,2025-09-02 11:03:00,YouTube,,2I9A58VxpOo,YouTube,,172
Ai shorts Cute Baby Dance #babyshorts #baby #ai #techartgenius #viralvideos #aishorts,37,0,0,37.0,2025-09-02 10:26:31,YouTube,,6srlnx5JO3s,YouTube,,37
GPT-5AIGPT-6#keep4oAI1on1,677,102,0,779.0,2025-09-02 10:01:14,YouTube,,ixvmRjWTto8,YouTube,,779
The Uncanny Valley Theory of Human Evolution | Prehistory For Sleep,0,0,0,0.0,2025-09-03 00:36:03,YouTube,,H1s6TfO5ErE,YouTube,,0
Why Is Evolution Theory Often Misunderstood? - Firsts of the World,0,0,0,0.0,2025-09-02 21:54:19,YouTube,,TQQffjVgBwo,YouTube,,0
How To Discuss Evolution Theory With Skeptics? - Firsts of the World,0,0,0,0.0,2025-09-02 21:38:18,YouTube,,vAPxKYlgsjs,YouTube,,0
Theory of Evolution Debate | Ghamidi &amp; Awais Iqbal,1,1,0,2.0,2025-09-02 21:34:20,YouTube,,6AiBqkt6i0I,YouTube,,2
How Darwins Theory of Evolution Changed the World Forever #CharlesDarwin #TheoryOfEvolution,0,0,0,0.0,2025-09-02 21:00:32,YouTube,,POdybz7XftM,YouTube,,0
&quot; Darwin      Evolution Theory?&quot;,2,1,0,3.0,2025-09-02 17:05:45,YouTube,,WM3Ke3QFMy8,YouTube,,3
Jurassic World Evolution 2 - Chaos Theory: Return to Isla Nublar (Ep. 01),0,0,0,0.0,2025-09-02 16:30:25,YouTube,,vhqOCgLdo98,YouTube,,0
Evolutionary theory of culture wars,16,7,0,23.0,2025-09-02 16:23:45,YouTube,,WEa3ZTvIjG0,YouTube,,23
The Evolution Of Mortimer Goth (Based on Sims Theory) #TheSims4  #TheSims2 #TheSims3 #MortimerGoth,6,0,0,6.0,2025-09-02 15:52:24,YouTube,,C_TzF7J2QrQ,YouTube,,6
Evolution - Theories Of Evolution - NEET NCERT Biology @bioneetirrg,3,0,0,3.0,2025-09-02 15:45:06,YouTube,,wZn2EB07jgc,YouTube,,3
Evolution - Theories Of Evolution - NEET NCERT Biology,3,2,0,5.0,2025-09-02 14:45:06,YouTube,,VMODZHiUzks,YouTube,,5
Chicken T-rex Theory #evolutiongonewrong,97,3,0,100.0,2025-09-02 14:33:47,YouTube,,aSrXvh3YvZs,YouTube,,100
Charles Darwin Biography in Hindi |       | Audiobook school,76,4,0,80.0,2025-09-02 14:30:37,YouTube,,jGGmNZNqAPo,YouTube,,80
evolution theory,0,0,0,0.0,2025-09-02 13:13:35,YouTube,,VUPjFECicoc,YouTube,,0
Theory of Evolution: Facts vs Fiction | How Life Began on Earth,0,0,0,0.0,2025-09-02 12:31:06,YouTube,,lIIU7Ug_0tg,YouTube,,0
When Did Quantum Computing First Start To Be Theorized? - Science Through Time,0,0,0,0.0,2025-09-03 06:25:27,YouTube,,jpc32Hls-Yo,YouTube,,0
IBM &amp; Moderna: Quantum Computing&#39;s Medical Breakthroughs #shorts,0,0,0,0.0,2025-09-03 05:29:38,YouTube,,N-SWy-Q1yDI,YouTube,,0
IBM &amp; Moderna: Quantum Computing&#39;s Medical Breakthroughs #shorts,1,0,0,1.0,2025-09-03 05:26:31,YouTube,,pxqJfNFJIpM,YouTube,,1
"Quantum Computing: The Biggest Misconception, Explained! #shorts",1,0,0,1.0,2025-09-03 04:14:38,YouTube,,wDdlSUuE24Y,YouTube,,1
