content,likes,comments,shares,Engagement_Score,timestamp,Platform,author,post_id,platform,Quotes,engagement_score
AI Agents Full Course 2025 | AI Agents Tutorial for Beginners | How to Build AI Agents | Simplilearn,216,0,0,216.0,2025-08-20 19:21:17,YouTube,,eFXPgpE1FlE,YouTube,,216
"pregnant cow  #ai #cow ,#animals",190,0,0,190.0,2025-08-20 15:27:54,YouTube,,dIPvN1iHhtY,YouTube,,190
AI REVEALS EXACT IBPS Interface &amp; Pattern  IBPS PO 2025 Quant Paper || Harshal Sir,634,0,0,634.0,2025-08-20 14:42:22,YouTube,,QCorgq59K8I,YouTube,,634
AGI is not coming - BIG AI doesn&#39;t want to admit it!,216,152,0,368.0,2025-08-20 13:56:58,YouTube,,J5wa7BgceO8,YouTube,,368
Babys Pigeon Was Caught by Scoundrels #ai #baby #pigeon,0,0,0,0.0,2025-08-20 12:24:30,YouTube,,o1W5GvhhMpg,YouTube,,0
When Was The Theory Of Evolution First Published? - Firsts of the World,0,0,0,0.0,2025-08-21 00:19:49,YouTube,,NFL3-qxxbXs,YouTube,,0
The Evolution of Critical Theory,0,0,0,0.0,2025-08-20 20:48:06,YouTube,,mX5ZAnmRcFc,YouTube,,0
Pokmon Fossils Never Went Extinct They EVOLVED | Pokemon Theory,857,268,0,1125.0,2025-08-20 20:19:58,YouTube,,PIdafp5uqXs,YouTube,,1125
The Big Bang Theory _ 2007 Cast Evolution 2025 #movie,6,0,0,6.0,2025-08-20 18:12:24,YouTube,,X2XAJTiFE28,YouTube,,6
Jurassic World Evolution: Chaos Theory - Part 14 - Jurassic world completed it mate,1,0,0,1.0,2025-08-20 17:31:15,YouTube,,T65NPfz_O6g,YouTube,,1
Darwin&#39;s Theory of evolution  vs &#39;Dashavtaras&#39; of Vishnu | Narsimha sketch |,8,1,0,9.0,2025-08-20 17:24:30,YouTube,,jpfvP0QgjDc,YouTube,,9
Science  Sanatan    || Evolution vs Dashavatara || #shorts,5,0,0,5.0,2025-08-20 14:38:00,YouTube,,6iCV76FXIho,YouTube,,5
Theory of Evolution,0,0,0,0.0,2025-08-20 14:16:53,YouTube,,ZxKabydacHo,YouTube,,0
"Theory Of Evolution - Mama I&#39;m Coming Home @ Oliver&#39;s Beer Garden Erie, PA 8-8-25",0,3,0,3.0,2025-08-20 13:50:26,YouTube,,TphfoF4kZCA,YouTube,,3
Evolution 01Origin of Life II Theories ofOrigin of LifeBy Aarushi Ma&#39;amBiology,0,0,0,0.0,2025-08-20 13:09:38,YouTube,,jlV_FeWeQ2g,YouTube,,0
Evolution Of Elephants  | #evolution #elephant #shorts,3,0,0,3.0,2025-08-20 12:45:17,YouTube,,N4B_4Da_smc,YouTube,,3
